{
  "schema_version": "2.0",
  "identity": {
    "spec_id": "hs_pytorch_torch.nn.functional.cosine_embedding_loss_controlled_baseline",
    "framework": "pytorch",
    "target_api": "torch.nn.functional.cosine_embedding_loss",
    "spec_mode": "controlled_baseline"
  },
  "revision_information": {
    "revision_number": 1,
    "parent_revision_ref": null,
    "derived_from_spec_ref": null,
    "feedback_request_ref": null,
    "revision_trigger": "initial_creation",
    "change_scopes": [
      "initial_definition"
    ],
    "change_summary": "Initial HarnessSpec synthesis",
    "lifecycle_status": "draft"
  },
  "target_context": {
    "api_profile_ref": {
      "profile_id": "api_prof:pytorch:v2.10.0:cpu:torch.nn.functional.cosine_embedding_loss:python_default:aten.cosine_embedding_loss.default",
      "revision": 6,
      "content_hash": "8140acffb5eccd0cbf6a58164522dcf08011564b37d8e0d0c2aa9d61e5f737dd"
    },
    "available_helper_profile_refs": [
      {
        "profile_id": "hp_pytorch_2.10.0_cpu_flashfuzz_base_torch_2_10_cpu_debug_instrumented_fuzzer_utils_comparetensors_96f975d59bc7",
        "revision": 2,
        "content_hash": "3a023fbd4f2abef1efebf74da7c09a39820fb5bcaf87108f06115dcaeaa9c7af"
      },
      {
        "profile_id": "hp_pytorch_2.10.0_cpu_flashfuzz_base_torch_2_10_cpu_debug_instrumented_fuzzer_utils_createtensor_14110b37b225",
        "revision": 2,
        "content_hash": "77ba0a7b4446c33e3dce2e9c738edb1b113013315817a75cfa00c8321f0b1f1e"
      },
      {
        "profile_id": "hp_pytorch_2.10.0_cpu_flashfuzz_base_torch_2_10_cpu_debug_instrumented_fuzzer_utils_currenttimestamp_c81f2a7d32da",
        "revision": 2,
        "content_hash": "ec490726fa6f4b7ef9bd2a590b3dfa352cfb9ab0f571edc48934d339daf8cccd"
      },
      {
        "profile_id": "hp_pytorch_2.10.0_cpu_flashfuzz_base_torch_2_10_cpu_debug_instrumented_fuzzer_utils_ensure_log_directory_exists_0998a5920e8b",
        "revision": 2,
        "content_hash": "ec5d435bfd631ae34cac1ef70c71eca7ba91352a354689b1b4da987604f6106c"
      },
      {
        "profile_id": "hp_pytorch_2.10.0_cpu_flashfuzz_base_torch_2_10_cpu_debug_instrumented_fuzzer_utils_logerrormessage_ffbff3bb0e31",
        "revision": 2,
        "content_hash": "225e26b459e805214d62aa15b3fcebe3ad4b5f4452adb17460d67abafdcfb7d9"
      },
      {
        "profile_id": "hp_pytorch_2.10.0_cpu_flashfuzz_base_torch_2_10_cpu_debug_instrumented_fuzzer_utils_parsedatatype_54f7f7e39ec2",
        "revision": 2,
        "content_hash": "d24f50a2b9ee76d060d46d3cd29e88d93a4e7c4afc1dd4775fbb964553aeafc6"
      },
      {
        "profile_id": "hp_pytorch_2.10.0_cpu_flashfuzz_base_torch_2_10_cpu_debug_instrumented_fuzzer_utils_parserank_f3fec1bde48a",
        "revision": 2,
        "content_hash": "883cb198e4fea076f62b4d8d4a585115c7a7841ea27323959b28c7dde95a6910"
      },
      {
        "profile_id": "hp_pytorch_2.10.0_cpu_flashfuzz_base_torch_2_10_cpu_debug_instrumented_fuzzer_utils_parseshape_bc0dff00f287",
        "revision": 2,
        "content_hash": "45ec76ea73190c533ebf6a8cedef5cf44c08278d9002a648f9166b85fd54bc2d"
      },
      {
        "profile_id": "hp_pytorch_2.10.0_cpu_flashfuzz_base_torch_2_10_cpu_debug_instrumented_fuzzer_utils_parsetensordata_326eeb67c32d",
        "revision": 2,
        "content_hash": "7c13a00d198673107c2a960c6372ae9884298aa09aedcf2609c2d5d45e2807cb"
      },
      {
        "profile_id": "hp_pytorch_2.10.0_cpu_flashfuzz_base_torch_2_10_cpu_debug_instrumented_fuzzer_utils_sanitizedtimestamp_3462aebdca72",
        "revision": 2,
        "content_hash": "2513caf9c97e44f09e903b2c0d9bbe74341defee995561980dd45cbd86141dc9"
      },
      {
        "profile_id": "hp_pytorch_2.10.0_cpu_flashfuzz_base_torch_2_10_cpu_debug_instrumented_fuzzer_utils_savediffinput_2413f328d009",
        "revision": 2,
        "content_hash": "6a45475e9d31bb95c9ad693af4b8366ef7ea671252b9d1fbb137ecd2b80d0608"
      },
      {
        "profile_id": "hp_pytorch_2.10.0_cpu_flashfuzz_base_torch_2_10_cpu_debug_instrumented_fuzzer_utils_saveerrorinput_315d3b0ca605",
        "revision": 2,
        "content_hash": "abd8268e9d0019a9a75c95eb96ac0d6b94eeba2e45a9b0ee3e832b1b2fc45086"
      }
    ],
    "framework_version": "v2.10.0",
    "backend_scope": [
      "cpu"
    ]
  },
  "knowledge_plan": {
    "knowledge_decisions": []
  },
  "validity_constraints": {
    "global_constraints": []
  },
  "exploration_plan": {
    "default_branch_id": "br_default",
    "budget_policy_ref": null,
    "branches": [
      {
        "branch_id": "br_default",
        "branch_kind": "default",
        "input_validity_intent": "expected_valid",
        "source_knowledge_ids": [],
        "grouping_summary": null,
        "exploration_goal": "Canonical general API-valid exploration of torch.nn.functional.cosine_embedding_loss.",
        "branch_constraints": [],
        "target_conditions": [],
        "behavior_observations": [],
        "behavior_checks": [],
        "budget_share": 1.0
      }
    ]
  },
  "provenance": {
    "generation_method": "llm",
    "generator_name": "harness_spec_builder_v0.14",
    "model_name": "deepseek-v4-pro",
    "generation_run_id": "run_20261004T103737Z_3c7b66399262",
    "script_ref": {
      "artifact_id": "build_harness_spec_json.py",
      "artifact_version": "harness_spec_builder_v0.14",
      "content_hash": "7918ac56acc739b92c81bc78ef16c6d05ebb0197283653d5435d7fbb387df17e"
    },
    "contract_ref": {
      "artifact_id": "harness_spec_synthesis_contract.json",
      "artifact_version": "2.0",
      "content_hash": "28aa0efd63ee51ec19cf9eb99affa04f931da56d038e8044462725ebe4e7ef2d"
    },
    "rules_ref": {
      "artifact_id": "knowledge_to_harness_spec_rules.md",
      "artifact_version": "2.0",
      "content_hash": "0ee2f3c760d4eb4d28d8eeaa9b0fcd7e8bf363f8e766a6a94204d67598f685be"
    },
    "generated_at": "2026-10-04T10:37:49.108555Z"
  },
  "review": {
    "validation_status": "passed",
    "validation_issues": [],
    "human_review_status": "not_reviewed",
    "reviewer_id": null,
    "reviewed_at": null,
    "review_notes": null
  }
}
